PathwayName,StartPathwayName,StartPoint,EndPathwayName,EndPoint
Disease,Mtb iron assimilation by chelation,"=HYPERLINK(""https://reactome.org/content/detail/R-HSA-1222738"",""Carboxymycobactin gets secreted"")",Defective SLC24A4 causes hypomineralized amelogenesis imperfecta (AI),"=HYPERLINK(""https://reactome.org/content/detail/R-HSA-5626270"",""Defective SLC24A4 does not exchange extracellular 4Na+ for cytosolic Ca2+, K+"")"
Disease,Signaling by FGFR2 amplification mutants,"=HYPERLINK(""https://reactome.org/content/detail/R-HSA-2029988"",""Dimerization of overexpressed FGFR2"")",InlA-mediated entry of Listeria monocytogenes into host cells,"=HYPERLINK(""https://reactome.org/content/detail/R-HSA-8877003"",""CBLL1 ubiqutinates the InlA-bound CDH1 complex"")"
Disease,Signaling by plasma membrane FGFR1 fusions,"=HYPERLINK(""https://reactome.org/content/detail/R-HSA-8853322"",""Plasma membrane FGFR1 fusions dimerize"")",Suppression of autophagy,"=HYPERLINK(""https://reactome.org/content/detail/R-HSA-9636564"",""SapM binds RAB7A"")"
Disease,Regulation of Complement cascade,"=HYPERLINK(""https://reactome.org/content/detail/R-HSA-444647"",""C3a receptor binds anaphylatoxin C3a"")",Attachment and Entry,"=HYPERLINK(""https://reactome.org/content/detail/R-HSA-9683467"",""CQ, HCQ are protonated to CQ2+, HCQ2+"")"
Disease,The NLRP3 inflammasome,"=HYPERLINK(""https://reactome.org/content/detail/R-HSA-874087"",""SGT1 binds HSP90"")",Signaling by MRAS-complex mutants,"=HYPERLINK(""https://reactome.org/content/detail/R-HSA-9660538"",""Mutant MRAS:SHOC2:PPP1CC complexes dephosphorylate inactive RAFs"")"
Disease,IkBA variant leads to EDA-ID,"=HYPERLINK(""https://reactome.org/content/detail/R-HSA-9630921"",""NFKBIA variant binds NFkB complex"")",Autointegration results in viral DNA circles,"=HYPERLINK(""https://reactome.org/content/detail/R-HSA-164845"",""Suicidal integration leading to inverted circle formation"")"
Disease,Modulation by Mtb of host immune system,"=HYPERLINK(""https://reactome.org/content/detail/R-HSA-9637651"",""esxA translocates from Mtb cytosol to the host's ER"")",Constitutive Signaling by AKT1 E17K in Cancer,"=HYPERLINK(""https://reactome.org/content/detail/R-HSA-2400001"",""AKT1 E17K mutant phosphorylates CHUK (IKKalpha)"")"
Disease,Signaling by ERBB2 KD Mutants,"=HYPERLINK(""https://reactome.org/content/detail/R-HSA-9665121"",""ERBB2 KD mutants bind TKIs"")",Purinergic signaling in leishmaniasis infection,"=HYPERLINK(""https://reactome.org/content/detail/R-HSA-9665515"",""P2RX4,7 binds itself to form trimeric non-selective cation channels"")"
Disease,Constitutive Signaling by Aberrant PI3K in Cancer,"=HYPERLINK(""https://reactome.org/content/detail/R-HSA-2394007"",""PI3K gain of function mutants phosphorylate PIP2 to PIP3"")",Nef and signal transduction,"=HYPERLINK(""https://reactome.org/content/detail/R-HSA-200858"",""Nef Binds and activates the Src-family tyrosine kinase Hck"")"
Disease,Translation of Replicase and Assembly of the Replication Transcription Complex,"=HYPERLINK(""https://reactome.org/content/detail/R-HSA-9687109"",""8b binds MAP1LC3B"")",Maturation of protein 3a,"=HYPERLINK(""https://reactome.org/content/detail/R-HSA-9685950"",""Endocytosis of protein 3a"")"
Disease,Assembly of Viral Components at the Budding Site,"=HYPERLINK(""https://reactome.org/content/detail/R-HSA-195734"",""Neuraminidase (NA) synthesis"")",Defective CYP26B1 causes Radiohumeral fusions with other skeletal and craniofacial anomalies (RHFCA),"=HYPERLINK(""https://reactome.org/content/detail/R-HSA-5602063"",""Defective CYP26B1 does not 4-hydroxylate atRA"")"
Disease,Assembly of Viral Components at the Budding Site,"=HYPERLINK(""https://reactome.org/content/detail/R-HSA-168882"",""Association of NP into rafts"")",Signaling by FGFR2 IIIa TM,"=HYPERLINK(""https://reactome.org/content/detail/R-HSA-8853320"",""FGFR2IIIa TM binds ligand and full length receptors to inhibit signaling"")"
Disease,Potential therapeutics for SARS,"=HYPERLINK(""https://reactome.org/content/detail/R-HSA-9683546"",""FURIN binds furin inhibitors"")",Deregulated CDK5 triggers multiple neurodegenerative pathways in Alzheimer's disease models,"=HYPERLINK(""https://reactome.org/content/detail/R-HSA-8863007"",""p25-bound CDK5 phosphorylates CDC25B"")"
Disease,Signaling by activated point mutants of FGFR3,"=HYPERLINK(""https://reactome.org/content/detail/R-HSA-2012084"",""Constitutive dimerization of FGFR3 cysteine mutants"")",Activated point mutants of FGFR2,"=HYPERLINK(""https://reactome.org/content/detail/R-HSA-2033486"",""Autocatalytic phosphorylation of FGFR2c mutants with enhanced ligand binding"")"
Disease,Inhibition of membrane repair,"=HYPERLINK(""https://reactome.org/content/detail/R-HSA-9697057"",""esxG binds esxH"")",Defective SLC34A2 causes PALM,"=HYPERLINK(""https://reactome.org/content/detail/R-HSA-5687585"",""Defective SLC34A2 does not cotransport HPO4(2-), 3Na+ from extracellular region to cytosol"")"
Disease,Assembly of Viral Components at the Budding Site,"=HYPERLINK(""https://reactome.org/content/detail/R-HSA-195733"",""M2 protein synthesis"")",Signaling by FGFR2 amplification mutants,"=HYPERLINK(""https://reactome.org/content/detail/R-HSA-2029992"",""Tyrosine kinase inhibitors bind to overexpressed FGFR2 variants"")"
Disease,Signaling by membrane-tethered fusions of PDGFRA or PDGFRB,"=HYPERLINK(""https://reactome.org/content/detail/R-HSA-9673760"",""Ligand-independent dimerization of membrane-tethered fusions of PDGFRA or PDGFRB"")",Toxicity of botulinum toxin type G (BoNT/G),"=HYPERLINK(""https://reactome.org/content/detail/R-HSA-5250962"",""BoNT/G LC cleaves target cell VAMP2"")"
Disease,Signaling by FGFR2 fusions,"=HYPERLINK(""https://reactome.org/content/detail/R-HSA-8853319"",""FGFR2 fusions dimerize"")",HIV elongation arrest and recovery,"=HYPERLINK(""https://reactome.org/content/detail/R-HSA-167481"",""Abortive termination of HIV-1 elongation after arrest"")"
Disease,Drug-mediated inhibition of ERBB2 signaling,"=HYPERLINK(""https://reactome.org/content/detail/R-HSA-9652277"",""ERBB2 binds trastuzumab"")",Defective ABCB11 causes PFIC2 and BRIC2,"=HYPERLINK(""https://reactome.org/content/detail/R-HSA-5678517"",""Defective ABCB11 does not transport bile salts from cytosol to extracellular region"")"
Disease,Signaling by kinase domain mutants of KIT,"=HYPERLINK(""https://reactome.org/content/detail/R-HSA-9669890"",""Constitutive phosphorylation of kinase domain KIT mutants"")",Constitutive Signaling by Overexpressed ERBB2,"=HYPERLINK(""https://reactome.org/content/detail/R-HSA-9634418"",""RAS guanyl-nucleotide exchange mediated by SOS1 in complex with GRB2 and ERBB2 homodimer:p-SHC1"")"
Disease,Constitutive Signaling by NOTCH1 HD+PEST Domain Mutants,"=HYPERLINK(""https://reactome.org/content/detail/R-HSA-2900765"",""Ubiquitination of DLL/JAG ligands upon binding to NOTCH1 HD+PEST domain mutants"")",Maturation of nucleoprotein,"=HYPERLINK(""https://reactome.org/content/detail/R-HSA-9683630"",""Nucleoprotein translocates to the plasma membrane"")"
Disease,Signaling by FGFR1 amplification mutants,"=HYPERLINK(""https://reactome.org/content/detail/R-HSA-5654544"",""Ligand-independent dimerization of overexpressed FGFR1c"")",Maturation of nucleoprotein,"=HYPERLINK(""https://reactome.org/content/detail/R-HSA-9683714"",""Unphosphorylated nucleoprotein translocates to the plasma membrane"")"
Disease,Signaling by FGFR2 IIIa TM,"=HYPERLINK(""https://reactome.org/content/detail/R-HSA-8851710"",""Aberrant alternative splicing yields a secreted FGFR2 IIIa TM disease variant"")",CD163 mediating an anti-inflammatory response,"=HYPERLINK(""https://reactome.org/content/detail/R-HSA-9663426"",""sCD163 binds MYH9 in T-cells"")"
Disease,Activated point mutants of FGFR2,"=HYPERLINK(""https://reactome.org/content/detail/R-HSA-2033479"",""Dimerization of FGFR2 point mutants with enhanced kinase activity"")",Tat-mediated HIV elongation arrest and recovery,"=HYPERLINK(""https://reactome.org/content/detail/R-HSA-167459"",""Abortive  termination of HIV-1 elongation after arrest (Tat-containing elongation complex)"")"
Disease,CD163 mediating an anti-inflammatory response,"=HYPERLINK(""https://reactome.org/content/detail/R-HSA-9662747"",""iRHOM2 transports ADAM17 from ER to the Golgi-network"")",Integration of viral DNA into host genomic DNA,"=HYPERLINK(""https://reactome.org/content/detail/R-HSA-164506"",""Gap repair completes provirus integration"")"
Disease,Inhibition of nitric oxide production,"=HYPERLINK(""https://reactome.org/content/detail/R-HSA-9636251"",""PPE2 binds KPNA1:KPNB1"")",Vif-mediated degradation of APOBEC3G,"=HYPERLINK(""https://reactome.org/content/detail/R-HSA-180603"",""Proteosome-mediated degradation of APOBEC3G"")"
Disease,Vpr-mediated induction of apoptosis by mitochondrial outer membrane permeabilization,"=HYPERLINK(""https://reactome.org/content/detail/R-HSA-180855"",""Translocation of Vpr to the mitochondria"")",Defective OPLAH causes 5-oxoprolinase deficiency (OPLAHD),"=HYPERLINK(""https://reactome.org/content/detail/R-HSA-5603208"",""Defective OPLAH does not hydrolyse OPRO"")"
Disease,Signaling by ERBB2 KD Mutants,"=HYPERLINK(""https://reactome.org/content/detail/R-HSA-9664567"",""ERBB2 KD mutants heterodimerize"")",WNT5:FZD7-mediated leishmania damping,"=HYPERLINK(""https://reactome.org/content/detail/R-HSA-9673789"",""Activated JNK phosphorylates c-JUN"")"
Disease,Uptake and function of diphtheria toxin,"=HYPERLINK(""https://reactome.org/content/detail/R-HSA-5336417"",""DT A:B binds HBEGF and CD9 on the target cell surface"")",Defective ABCA3 causes SMDP3,"=HYPERLINK(""https://reactome.org/content/detail/R-HSA-5683672"",""Defective ABCA3 does not transport PC, PG from ER membrane to lamellar body"")"
Disease,Signaling by ERBB2 TMD/JMD mutants,"=HYPERLINK(""https://reactome.org/content/detail/R-HSA-9665697"",""ERBB2 TMD/JMD mutants hetrodimerize"")",Maturation of nucleoprotein,"=HYPERLINK(""https://reactome.org/content/detail/R-HSA-9694345"",""Nucleoprotein translocates to the nucleolus"")"
Disease,The NLRP3 inflammasome,"=HYPERLINK(""https://reactome.org/content/detail/R-HSA-1250280"",""ROS oxidize thioredoxin"")",Viral Messenger RNA Synthesis,"=HYPERLINK(""https://reactome.org/content/detail/R-HSA-192925"",""Export of Spliced Viral mRNA"")"
Disease,FGFR4 mutant receptor activation,"=HYPERLINK(""https://reactome.org/content/detail/R-HSA-2038946"",""Dimerization of FGFR4 mutants with enhanced kinase activity"")",Defective SLC12A3 causes Gitelman syndrome (GS),"=HYPERLINK(""https://reactome.org/content/detail/R-HSA-5623705"",""Defective SLC12A3 does not cotransport Cl-, Na+ from extracellular region to cytosol"")"
Disease,Tolerance by Mtb to nitric oxide produced by macrophages,"=HYPERLINK(""https://reactome.org/content/detail/R-HSA-1222594"",""Mycothiol scavenges nitrosyl"")",Abortive elongation of HIV-1 transcript in the absence of Tat,"=HYPERLINK(""https://reactome.org/content/detail/R-HSA-167147"",""Separation of abortive HIV-1 transcript from template"")"
Disease,Assembly of Viral Components at the Budding Site,"=HYPERLINK(""https://reactome.org/content/detail/R-HSA-168884"",""Hemagglutinin (HA) protein synthesis"")","Signaling by PDGFRA transmembrane, juxtamembrane and kinase domain mutants","=HYPERLINK(""https://reactome.org/content/detail/R-HSA-9672176"",""STAT binds to the mutant PDGFRA receptor"")"
Disease,Maturation of spike protein,"=HYPERLINK(""https://reactome.org/content/detail/R-HSA-9686790"",""ER-alpha glucosidases bind ER-alpha glucosidase inhibitors"")",Potential therapeutics for SARS,"=HYPERLINK(""https://reactome.org/content/detail/R-HSA-9681616"",""AP2 binds chlorpromazine"")"
Disease,The NLRP3 inflammasome,"=HYPERLINK(""https://reactome.org/content/detail/R-HSA-844610"",""ASC is recruited via a PYD-PYD interaction"")",Signaling by FGFR3 point mutants in cancer,"=HYPERLINK(""https://reactome.org/content/detail/R-HSA-5655277"",""Activated FGFR3 mutants:p-FRS2:GRB2:SOS1 activates RAS nucleotide exchange"")"
Disease,LTC4-CYSLTR mediated IL4 production,"=HYPERLINK(""https://reactome.org/content/detail/R-HSA-266046"",""GGT1, 5 dimers hydrolyse LTC4 to LTD4"")",Toxicity of botulinum toxin type F (BoNT/F),"=HYPERLINK(""https://reactome.org/content/detail/R-HSA-194808"",""BoNT/F LC cleaves target cell VAMP1"")"
Disease,Translation of Replicase and Assembly of the Replication Transcription Complex,"=HYPERLINK(""https://reactome.org/content/detail/R-HSA-9687121"",""nsp8 binds MAP1LC3B"")","Defective SLC4A1 causes hereditary spherocytosis type 4 (HSP4),  distal renal tubular acidosis (dRTA) and dRTA with hemolytic anemia (dRTA-HA)","=HYPERLINK(""https://reactome.org/content/detail/R-HSA-5656248"",""Defective SLC4A1 does not exchange Cl- for HCO3- (in erythrocytes)"")"
Disease,,,Replication of the SARS-CoV-1 genome,"=HYPERLINK(""https://reactome.org/content/detail/R-HSA-9682009"",""ZCRB1 binds 5'UTR of SARS-CoV-1 genomic RNA"")"
Disease,,,FCGR3A-mediated phagocytosis,"=HYPERLINK(""https://reactome.org/content/detail/R-HSA-9666458"",""IgG:Leishmania surface:FCGR3A translocates from plasma membrane to the parasitophorous vacuole"")"
Disease,,,Toxicity of botulinum toxin type A (BoNT/A),"=HYPERLINK(""https://reactome.org/content/detail/R-HSA-194818"",""BoNT/A LC cleaves target cell SNAP25"")"
Disease,,,Uptake and function of anthrax toxins,"=HYPERLINK(""https://reactome.org/content/detail/R-HSA-5211405"",""Anthrax LF cleaves target cell MAP2K6 (MEK6)"")"
Disease,,,Nef mediated downregulation of CD28 cell surface expression,"=HYPERLINK(""https://reactome.org/content/detail/R-HSA-167637"",""Internalization of Nef:CD28:Clathrin-Coated Pit Adapter Protein Complex"")"
Disease,,,Replication of the SARS-CoV-1 genome,"=HYPERLINK(""https://reactome.org/content/detail/R-HSA-9682631"",""nsp13 binds DDX5"")"
Disease,,,Toxicity of botulinum toxin type D (BoNT/D),"=HYPERLINK(""https://reactome.org/content/detail/R-HSA-5250606"",""BoNT/D LC cleaves target cell VAMP2"")"
Disease,,,Replication of the SARS-CoV-2 genome,"=HYPERLINK(""https://reactome.org/content/detail/R-HSA-9694406"",""nsp13 binds DDX5"")"
Disease,,,Signaling by cytosolic FGFR1 fusion mutants,"=HYPERLINK(""https://reactome.org/content/detail/R-HSA-1839112"",""Phosphorylation of STAT5 by cytosolic FGFR1 fusions"")"
Disease,,,Replication of the SARS-CoV-2 genome,"=HYPERLINK(""https://reactome.org/content/detail/R-HSA-9694520"",""nsp16 binds VHL"")"
Disease,,,Variant SLC6A14 may confer susceptibility towards obesity,"=HYPERLINK(""https://reactome.org/content/detail/R-HSA-5659674"",""Variant SLC6A14 cotransports SLC6A14 ligands, Cl-, 2Na+ from extracellular region to cytosol"")"
Disease,,,InlB-mediated entry of Listeria monocytogenes into host cell,"=HYPERLINK(""https://reactome.org/content/detail/R-HSA-8876262"",""EPS15 and HGS bind CBL-monoubiquitinated MET engaged with Listeria InlB"")"
Disease,,,Signaling by FGFR2 in disease,"=HYPERLINK(""https://reactome.org/content/detail/R-HSA-5655241"",""Activated FGFR2 mutants:p-FRS2:GRB2:SOS1 activates RAS nucleotide exchange"")"
Disease,,,Defective CYP26C1 causes Focal facial dermal dysplasia 4 (FFDD4),"=HYPERLINK(""https://reactome.org/content/detail/R-HSA-5602050"",""Defective CYP26C1 does not 4-hydroxylate 9cRA"")"
Disease,,,Deregulated CDK5 triggers multiple neurodegenerative pathways in Alzheimer's disease models,"=HYPERLINK(""https://reactome.org/content/detail/R-HSA-8868344"",""CDK5:p25 phosphorylates lamin A"")"
Disease,,,HCMV Late Events,"=HYPERLINK(""https://reactome.org/content/detail/R-HSA-9698933"",""HCMV B Nucleocapsid Translocation"")"
Disease,,,Translation of Replicase and Assembly of the Replication Transcription Complex,"=HYPERLINK(""https://reactome.org/content/detail/R-HSA-9687435"",""Enhanced autophagosome formation"")"
Disease,,,Activated point mutants of FGFR2,"=HYPERLINK(""https://reactome.org/content/detail/R-HSA-2033488"",""Autocatalytic phosphorylation of FGFR2b mutants with enhanced ligand binding"")"
Disease,,,Signaling by FGFR4 in disease,"=HYPERLINK(""https://reactome.org/content/detail/R-HSA-5655347"",""Activated FGFR4 mutants:p-FRS2:GRB2:SOS1 activates RAS nucleotide exchange"")"
Disease,,,Tolerance by Mtb to nitric oxide produced by macrophages,"=HYPERLINK(""https://reactome.org/content/detail/R-HSA-1222723"",""Nitric oxide is oxidized to nitrate"")"
Disease,,,Constitutive Signaling by AKT1 E17K in Cancer,"=HYPERLINK(""https://reactome.org/content/detail/R-HSA-2399988"",""AKT1 E17K mutant phosphorylates NR4A1 (NUR77)"")"
Disease,,,APOBEC3G mediated resistance to HIV-1 infection,"=HYPERLINK(""https://reactome.org/content/detail/R-HSA-180630"",""Association of APOBEC3G with Gag"")"
Disease,,,Nef and signal transduction,"=HYPERLINK(""https://reactome.org/content/detail/R-HSA-200908"",""Nef Binds and activates the Src-family tyrosine kinase Fyn"")"
Disease,,,Constitutive Signaling by NOTCH1 PEST Domain Mutants,"=HYPERLINK(""https://reactome.org/content/detail/R-HSA-2220966"",""NOTCH1 PEST domain mutants stimulate HES5 transcription"")"
Disease,,,Constitutive Signaling by NOTCH1 PEST Domain Mutants,"=HYPERLINK(""https://reactome.org/content/detail/R-HSA-2220979"",""NOTCH1 PEST domain mutants stimulate HES1 transcription"")"
Disease,,,Constitutive Signaling by AKT1 E17K in Cancer,"=HYPERLINK(""https://reactome.org/content/detail/R-HSA-2399977"",""AKT1 E17K mutant phosphorylates AKT1S1 (PRAS40)"")"
Disease,,,Signaling by cytosolic FGFR1 fusion mutants,"=HYPERLINK(""https://reactome.org/content/detail/R-HSA-1888198"",""FGFR1OP-FGFR1 phosphorylates STAT1 and STAT3"")"
Disease,,,Autointegration results in viral DNA circles,"=HYPERLINK(""https://reactome.org/content/detail/R-HSA-175250"",""Suicidal integration leading to smaller circles of viral DNA"")"
Disease,,,Defective SLC26A3 causes congenital secretory chloride diarrhea 1 (DIAR1),"=HYPERLINK(""https://reactome.org/content/detail/R-HSA-5627737"",""SLC26A3 does not exchange Cl- for HCO3-"")"
Disease,,,Vpu mediated degradation of CD4,"=HYPERLINK(""https://reactome.org/content/detail/R-HSA-180573"",""Degradation of ubiquitinated CD4"")"
Disease,,,Defective ABCA12 causes ARCI4B,"=HYPERLINK(""https://reactome.org/content/detail/R-HSA-5682311"",""Defective ABCA12 does not transport lipids from cytosol to extracellular region"")"
Disease,,,Retinoid cycle disease events,"=HYPERLINK(""https://reactome.org/content/detail/R-HSA-2466832"",""Defective RDH5 does not oxidise 11cROL to 11cRAL and causes RPA"")"
Disease,,,Tat-mediated elongation of the HIV-1 transcript,"=HYPERLINK(""https://reactome.org/content/detail/R-HSA-167197"",""Separation of elongating HIV-1 transcript from template"")"
Disease,,,Defective AHCY causes Hypermethioninemia with S-adenosylhomocysteine hydrolase deficiency (HMAHCHD),"=HYPERLINK(""https://reactome.org/content/detail/R-HSA-5579084"",""Defective AHCY does not hydrolyse AdoHcy"")"
Disease,,,Maturation of spike protein,"=HYPERLINK(""https://reactome.org/content/detail/R-HSA-9697018"",""Addition of sialic acids on some Spike glycosyl sidechains"")"
Disease,,,Prevention of phagosomal-lysosomal fusion,"=HYPERLINK(""https://reactome.org/content/detail/R-HSA-9635667"",""esxG:esxH binds HGS"")"
Disease,,,Deregulated CDK5 triggers multiple neurodegenerative pathways in Alzheimer's disease models,"=HYPERLINK(""https://reactome.org/content/detail/R-HSA-8868567"",""CDK5:p25 phosphorylates PRDX1"")"
Disease,,,Constitutive Signaling by AKT1 E17K in Cancer,"=HYPERLINK(""https://reactome.org/content/detail/R-HSA-2399999"",""AKT1 E17K mutant phosphorylates RSK"")"
Disease,,,Constitutive Signaling by AKT1 E17K in Cancer,"=HYPERLINK(""https://reactome.org/content/detail/R-HSA-2399985"",""AKT1 E17K mutant phosphorylates caspase-9"")"
Disease,,,Uptake and function of anthrax toxins,"=HYPERLINK(""https://reactome.org/content/detail/R-HSA-5211400"",""Anthrax LF cleaves target cell MAP2K3 (MEK3)"")"
Disease,,,Defective CYP21A2 causes Adrenal hyperplasia 3 (AH3),"=HYPERLINK(""https://reactome.org/content/detail/R-HSA-5601976"",""Defective CYP21A2 does not 21-hydroxylate PROG"")"
Disease,,,Defective SLC6A18 may confer susceptibility to iminoglycinuria and/or hyperglycinuria,"=HYPERLINK(""https://reactome.org/content/detail/R-HSA-5659755"",""Defective SLC6A18 does not transport Gly from extracellular region to cytosol"")"
Disease,,,Nef and signal transduction,"=HYPERLINK(""https://reactome.org/content/detail/R-HSA-164943"",""Nef mediated activation of the T-cell receptor"")"
Disease,,,Defective CYP17A1 causes Adrenal hyperplasia 5 (AH5),"=HYPERLINK(""https://reactome.org/content/detail/R-HSA-5601843"",""Defective CYP17A1 does not 17-hydroxylate PREG"")"
Disease,,,Suppression of apoptosis,"=HYPERLINK(""https://reactome.org/content/detail/R-HSA-9635461"",""PtpA dephosphorylates GSK3A"")"
Disease,,,Uptake and function of anthrax toxins,"=HYPERLINK(""https://reactome.org/content/detail/R-HSA-5211391"",""Anthrax LF cleaves target cell MAP2K4 (MEK4)"")"
Disease,,,Signaling by PDGFRA extracellular domain mutants,"=HYPERLINK(""https://reactome.org/content/detail/R-HSA-9672159"",""STAT binds to p-11Y PDGFRA extracellular domain dimers "")"
Disease,,,"Defective CYP7B1 causes Spastic paraplegia 5A, autosomal recessive (SPG5A) and Congenital bile acid synthesis defect 3 (CBAS3)","=HYPERLINK(""https://reactome.org/content/detail/R-HSA-5602885"",""Defective CYP7B1 does not 7-hydroxylate 25OH-CHOL"")"
Disease,,,Constitutive Signaling by AKT1 E17K in Cancer,"=HYPERLINK(""https://reactome.org/content/detail/R-HSA-2399981"",""AKT1 E17K mutant phosphorylates MDM2"")"
Disease,,,Constitutive Signaling by EGFRvIII,"=HYPERLINK(""https://reactome.org/content/detail/R-HSA-5637794"",""EGFRvIII does not bind CBL"")"
Disease,,,Integration of provirus,"=HYPERLINK(""https://reactome.org/content/detail/R-HSA-175117"",""1-LTR circle formation"")"
Disease,,,Signaling by PDGFRA extracellular domain mutants,"=HYPERLINK(""https://reactome.org/content/detail/R-HSA-9672163"",""SOS-mediated nucleotide exchange on RAS downstream of PDGFRA extracellular domain dimers"")"
Disease,,,Defective MMACHC causes methylmalonic aciduria and homocystinuria type cblC,"=HYPERLINK(""https://reactome.org/content/detail/R-HSA-3318590"",""Defective MMACHC does not decyanate CNCbl"")"
Disease,,,Constitutive Signaling by EGFRvIII,"=HYPERLINK(""https://reactome.org/content/detail/R-HSA-5637808"",""SOS-mediated nucleotide exchange of RAS (mediated by GRB2:SOS1 in complex with phosphorylated SHC1 and p-EGFRvIII)"")"
Disease,,,Defective SLC40A1 causes hemochromatosis 4 (HFE4) (macrophages),"=HYPERLINK(""https://reactome.org/content/detail/R-HSA-5655733"",""Defective SLC40A1 does not transport Fe2+ from cytosol to extracellular region"")"
Disease,,,Deregulated CDK5 triggers multiple neurodegenerative pathways in Alzheimer's disease models,"=HYPERLINK(""https://reactome.org/content/detail/R-HSA-8870686"",""BCL2L11 (BIM) gene expression"")"
Disease,,,Retinoid cycle disease events,"=HYPERLINK(""https://reactome.org/content/detail/R-HSA-2466802"",""Defective ABCA4 does not transport NRPE from disc membranes"")"
Disease,,,Defective FMO3 causes Trimethylaminuria (TMAU),"=HYPERLINK(""https://reactome.org/content/detail/R-HSA-5602966"",""Defective FMO3 does not N-oxidise TMA"")"
Disease,,,Signaling by ERBB2 KD Mutants,"=HYPERLINK(""https://reactome.org/content/detail/R-HSA-9665009"",""RAS activation by SOS1 bound to phosphorylated heterodimers of ERBB2 KD mutants and EGFR"")"
Disease,,,Defective MMACHC causes methylmalonic aciduria and homocystinuria type cblC,"=HYPERLINK(""https://reactome.org/content/detail/R-HSA-3318576"",""Defective MMACHC does not reduce Cbl"")"
Disease,,,"Signaling by phosphorylated juxtamembrane, extracellular and kinase domain KIT mutants","=HYPERLINK(""https://reactome.org/content/detail/R-HSA-9670436"",""p-KIT mutants:GRB2:SOS catalyzes nucleotide exchange on RAS"")"
Disease,,,Constitutive Signaling by AKT1 E17K in Cancer,"=HYPERLINK(""https://reactome.org/content/detail/R-HSA-2399982"",""AKT1 E17K mutant phosphorylates TSC2, inhibiting it"")"
Disease,,,Defective SLC12A1 causes Bartter syndrome 1 (BS1),"=HYPERLINK(""https://reactome.org/content/detail/R-HSA-5623588"",""Defective SLC12A1 does not cotransport Na+, K+, 2Cl- from extracellular region to cytosol"")"
Disease,,,Signaling by FGFR2 amplification mutants,"=HYPERLINK(""https://reactome.org/content/detail/R-HSA-2067713"",""GP369 inhibits activation of amplified FGFR2 signaling"")"
Disease,,,Toxicity of botulinum toxin type B (BoNT/B),"=HYPERLINK(""https://reactome.org/content/detail/R-HSA-194796"",""BoNT/B LC cleaves target cell VAMP2"")"
Disease,,,Signaling by cytosolic PDGFRA and PDGFRB fusion proteins,"=HYPERLINK(""https://reactome.org/content/detail/R-HSA-9673756"",""Autophosphorylation of cytosolic PDGFRA and PDGFRB fusion proteins"")"
Disease,,,Signaling by FGFR3 fusions in cancer,"=HYPERLINK(""https://reactome.org/content/detail/R-HSA-8853307"",""FGFR3 fusions:p-FRS2:GRB2:SOS1 activates RAS nucleotide exchange"")"
Disease,,,Constitutive Signaling by Ligand-Responsive EGFR Cancer Variants,"=HYPERLINK(""https://reactome.org/content/detail/R-HSA-1225956"",""Inefficient ubiquitination of ligand-responsive p-6Y-EGFR mutants by p-Y371-CBL"")"
Disease,,,Defective CYP2R1 causes Rickets vitamin D-dependent 1B (VDDR1B),"=HYPERLINK(""https://reactome.org/content/detail/R-HSA-5602147"",""Defective CYP2R1 does not 25-hydroxylate vitamin D"")"
Disease,,,Toxicity of botulinum toxin type E (BoNT/E),"=HYPERLINK(""https://reactome.org/content/detail/R-HSA-194800"",""BoNT/E LC cleaves target cell SNAP25"")"
Disease,,,Constitutive Signaling by NOTCH1 PEST Domain Mutants,"=HYPERLINK(""https://reactome.org/content/detail/R-HSA-2220967"",""p-NICD1 PEST domain mutants do not bind FBXW7"")"
