PathwayName,StartPathwayName,StartPoint,StartPoint_in_Path?,EndPathwayName,EndPoint,EndPoint_in_Path?
Disease,,,,Vpr-mediated induction of apoptosis by mitochondrial outer membrane permeabilization,"=HYPERLINK(""https://reactome.org/content/detail/R-HSA-180905"",""Association of Vpr with ANT1"")",Yes
Disease,,,,Defective CFTR causes cystic fibrosis,"=HYPERLINK(""https://reactome.org/content/detail/R-HSA-5678822"",""Defective CFTR does not transport Cl- from cytosol to extracellular region"")",Yes
Disease,,,,Prevention of phagosomal-lysosomal fusion,"=HYPERLINK(""https://reactome.org/content/detail/R-HSA-9635667"",""esxG:esxH binds HGS"")",Yes
Disease,,,,Prevention of phagosomal-lysosomal fusion,"=HYPERLINK(""https://reactome.org/content/detail/R-HSA-9636404"",""LAM translocates from the cell wall to the plasma membrane"")",Yes
Disease,,,,Constitutive Signaling by AKT1 E17K in Cancer,"=HYPERLINK(""https://reactome.org/content/detail/R-HSA-2399969"",""AKT1 E17K mutant phosphorylates p21Cip1 and p27Kip1"")",Yes
Disease,,,,Purinergic signaling in leishmaniasis infection,"=HYPERLINK(""https://reactome.org/content/detail/R-HSA-9665515"",""P2RX4,7 binds itself to form trimeric non-selective cation channels"")",Yes
Disease,,,,Defective SLC6A18 may confer susceptibility to iminoglycinuria and/or hyperglycinuria,"=HYPERLINK(""https://reactome.org/content/detail/R-HSA-5659755"",""Defective SLC6A18 does not transport Gly from extracellular region to cytosol"")",Yes
Disease,,,,APOBEC3G mediated resistance to HIV-1 infection,"=HYPERLINK(""https://reactome.org/content/detail/R-HSA-180630"",""Association of APOBEC3G with Gag"")",Yes
Disease,,,,Defective SLC34A1 causes hypophosphatemic nephrolithiasis/osteoporosis 1 (NPHLOP1),"=HYPERLINK(""https://reactome.org/content/detail/R-HSA-5651685"",""Defective SLC34A1 does not cotransport Pi, 3Na+"")",Yes
Disease,,,,Prevention of phagosomal-lysosomal fusion,"=HYPERLINK(""https://reactome.org/content/detail/R-HSA-9636439"",""PtpA:Ub dephosphorylates p-Y133-VPS33B"")",Yes
Disease,,,,ADORA2B mediated anti-inflammatory cytokines production,"=HYPERLINK(""https://reactome.org/content/detail/R-HSA-9662710"",""IL6 gene produces IL6 protein"")",Yes
Disease,,,,Prevention of phagosomal-lysosomal fusion,"=HYPERLINK(""https://reactome.org/content/detail/R-HSA-9636457"",""SapM dephosphorylates PI3P"")",Yes
Disease,,,,HCMV Late Events,"=HYPERLINK(""https://reactome.org/content/detail/R-HSA-9698933"",""HCMV B Nucleocapsid Translocation"")",Yes
Disease,,,,IkBA variant leads to EDA-ID,"=HYPERLINK(""https://reactome.org/content/detail/R-HSA-5228811"",""NFKBIA variant is not phosphorylated within IkBA:NF-kappaB"")",Yes
Disease,,,,Deregulated CDK5 triggers multiple neurodegenerative pathways in Alzheimer's disease models,"=HYPERLINK(""https://reactome.org/content/detail/R-HSA-8868573"",""CDK5:p25 phosphorylates PRDX2"")",Yes
Disease,,,,Toxicity of botulinum toxin type C (BoNT/C),"=HYPERLINK(""https://reactome.org/content/detail/R-HSA-194793"",""BoNT/C LC cleaves target cell SNAP25"")",Yes
Disease,,,,Defective ABCG8 causes GBD4 and sitosterolemia,"=HYPERLINK(""https://reactome.org/content/detail/R-HSA-5679101"",""Defective ABCG8 (in ABCG5:ABCG8) does not transport sterols from cytosol to extracellular region"")",Yes
Disease,,,,Loss of phosphorylation of MECP2 at T308,"=HYPERLINK(""https://reactome.org/content/detail/R-HSA-9005561"",""Active PKA, CaMK IV do not phosphorylate MECP2 mutants R306C,(R306H) at T308"")",Yes
Disease,,,,Constitutive Signaling by NOTCH1 PEST Domain Mutants,"=HYPERLINK(""https://reactome.org/content/detail/R-HSA-2220967"",""p-NICD1 PEST domain mutants do not bind FBXW7"")",Yes
Disease,,,,Formation of the HIV-1 Early Elongation Complex,"=HYPERLINK(""https://reactome.org/content/detail/R-HSA-167478"",""Abortive termination of HIV-1 early transcription elongation by DSIF:NELF"")",Yes
Disease,,,,Retinoid cycle disease events,"=HYPERLINK(""https://reactome.org/content/detail/R-HSA-2466861"",""Defective RDH12 does not reduce atRAL to atROL and causes LCA13"")",Yes
Disease,,,,Constitutive Signaling by AKT1 E17K in Cancer,"=HYPERLINK(""https://reactome.org/content/detail/R-HSA-2399966"",""AKT1 E17K mutant phosphorylates GSK3"")",Yes
Disease,,,,"Defective SLC4A1 causes hereditary spherocytosis type 4 (HSP4),  distal renal tubular acidosis (dRTA) and dRTA with hemolytic anemia (dRTA-HA)","=HYPERLINK(""https://reactome.org/content/detail/R-HSA-5656248"",""Defective SLC4A1 does not exchange Cl- for HCO3- (in erythrocytes)"")",Yes
Disease,,,,Nef mediated downregulation of CD28 cell surface expression,"=HYPERLINK(""https://reactome.org/content/detail/R-HSA-167637"",""Internalization of Nef:CD28:Clathrin-Coated Pit Adapter Protein Complex"")",Yes
Disease,,,,InlB-mediated entry of Listeria monocytogenes into host cell,"=HYPERLINK(""https://reactome.org/content/detail/R-HSA-8876262"",""EPS15 and HGS bind CBL-monoubiquitinated MET engaged with Listeria InlB"")",Yes
Disease,,,,Signaling by FGFR1 amplification mutants,"=HYPERLINK(""https://reactome.org/content/detail/R-HSA-2023462"",""Tyrosine kinase inhibitors bind and inhibit overexpressed FGFR1 dimers"")",Yes
Disease,,,,APOBEC3G mediated resistance to HIV-1 infection,"=HYPERLINK(""https://reactome.org/content/detail/R-HSA-180632"",""Deamination of C residues during synthesis of HIV-1 reverse transcript minus-strand"")",Yes
Disease,,,,Translation of Replicase and Assembly of the Replication Transcription Complex,"=HYPERLINK(""https://reactome.org/content/detail/R-HSA-9698265"",""Enhanced autophagosome formation"")",Yes
Disease,,,,Constitutive Signaling by EGFRvIII,"=HYPERLINK(""https://reactome.org/content/detail/R-HSA-5637806"",""SOS-mediated nucleotide exchange of RAS (mediated by GRB2:SOS1 in complex with p-EGFRvIII)"")",Yes
Disease,,,,"Defective ABCB4 causes PFIC3, ICP3 and GBD1","=HYPERLINK(""https://reactome.org/content/detail/R-HSA-5678749"",""Defective ABCB4 does not transport PC from plasma membrane to extracellular region"")",Yes
Disease,,,,Maturation of protein 3a,"=HYPERLINK(""https://reactome.org/content/detail/R-HSA-9685950"",""Endocytosis of protein 3a"")",Yes
Disease,,,,PTEN Loss of Function in Cancer,"=HYPERLINK(""https://reactome.org/content/detail/R-HSA-2317387"",""PTEN cancer mutants do not dephosphorylate PIP3"")",Yes
Disease,,,,Myoclonic epilepsy of Lafora,"=HYPERLINK(""https://reactome.org/content/detail/R-HSA-3791349"",""Defective EPM2A does not dephosphorylate phosphoglycogen (type 2A disease)"")",Yes
Disease,,,,Inhibition of Host mRNA Processing and RNA Silencing,"=HYPERLINK(""https://reactome.org/content/detail/R-HSA-168883"",""Binding of NS1 to poly(A)-binding protein II (PABII)"")",Yes
Disease,,,,Uptake and function of anthrax toxins,"=HYPERLINK(""https://reactome.org/content/detail/R-HSA-5211340"",""Anthrax LF cleaves target cell MAP2K1 (MEK1)"")",Yes
Disease,,,,Toxicity of botulinum toxin type G (BoNT/G),"=HYPERLINK(""https://reactome.org/content/detail/R-HSA-5250962"",""BoNT/G LC cleaves target cell VAMP2"")",Yes
Disease,,,,Deregulated CDK5 triggers multiple neurodegenerative pathways in Alzheimer's disease models,"=HYPERLINK(""https://reactome.org/content/detail/R-HSA-8868567"",""CDK5:p25 phosphorylates PRDX1"")",Yes
Disease,,,,Deregulated CDK5 triggers multiple neurodegenerative pathways in Alzheimer's disease models,"=HYPERLINK(""https://reactome.org/content/detail/R-HSA-8870686"",""BCL2L11 (BIM) gene expression"")",Yes
Disease,,,,Constitutive Signaling by AKT1 E17K in Cancer,"=HYPERLINK(""https://reactome.org/content/detail/R-HSA-2399941"",""AKT1 E17K mutant phosphorylates BAD"")",Yes
Disease,,,,Constitutive Signaling by EGFRvIII,"=HYPERLINK(""https://reactome.org/content/detail/R-HSA-5637808"",""SOS-mediated nucleotide exchange of RAS (mediated by GRB2:SOS1 in complex with phosphorylated SHC1 and p-EGFRvIII)"")",Yes
Disease,,,,Deregulated CDK5 triggers multiple neurodegenerative pathways in Alzheimer's disease models,"=HYPERLINK(""https://reactome.org/content/detail/R-HSA-8868344"",""CDK5:p25 phosphorylates lamin A"")",Yes
Disease,,,,"Signaling by PDGFRA transmembrane, juxtamembrane and kinase domain mutants","=HYPERLINK(""https://reactome.org/content/detail/R-HSA-9672176"",""STAT binds to the mutant PDGFRA receptor"")",Yes
Disease,,,,Signaling by high-kinase activity BRAF mutants,"=HYPERLINK(""https://reactome.org/content/detail/R-HSA-6802938"",""Inhibitors bind and inhibit highly active BRAF mutants"")",Yes
Disease,,,,Replication of the SARS-CoV-2 genome,"=HYPERLINK(""https://reactome.org/content/detail/R-HSA-9694390"",""nsp15 binds RB1"")",Yes
Disease,,,,Signaling by ERBB2 TMD/JMD mutants,"=HYPERLINK(""https://reactome.org/content/detail/R-HSA-9665700"",""RAS activation by SOS1 bound to phosphorylated heterodimers of ERBB2 TMD/JMD mutants"")",Yes
Disease,,,,Interleukin-1 processing,"=HYPERLINK(""https://reactome.org/content/detail/R-HSA-449058"",""Interleukin-1 family are secreted"")",Yes
Disease,,,,WNT5:FZD7-mediated leishmania damping,"=HYPERLINK(""https://reactome.org/content/detail/R-HSA-9673789"",""Activated JNK phosphorylates c-JUN"")",Yes
Disease,,,,Suppression of apoptosis,"=HYPERLINK(""https://reactome.org/content/detail/R-HSA-9635461"",""PtpA dephosphorylates GSK3A"")",Yes
Disease,,,,"Signaling by phosphorylated juxtamembrane, extracellular and kinase domain KIT mutants","=HYPERLINK(""https://reactome.org/content/detail/R-HSA-9670436"",""p-KIT mutants:GRB2:SOS catalyzes nucleotide exchange on RAS"")",Yes
Disease,,,,Signaling by FGFR1 amplification mutants,"=HYPERLINK(""https://reactome.org/content/detail/R-HSA-5654545"",""Ligand-independent phosphorylation of overexpressed FGFR1c"")",Yes
Disease,,,,Toxicity of botulinum toxin type G (BoNT/G),"=HYPERLINK(""https://reactome.org/content/detail/R-HSA-5250978"",""BoNT/G LC cleaves target cell VAMP1"")",Yes
Disease,,,,Uptake and function of anthrax toxins,"=HYPERLINK(""https://reactome.org/content/detail/R-HSA-5211405"",""Anthrax LF cleaves target cell MAP2K6 (MEK6)"")",Yes
Disease,,,,Defective SLC12A1 causes Bartter syndrome 1 (BS1),"=HYPERLINK(""https://reactome.org/content/detail/R-HSA-5623588"",""Defective SLC12A1 does not cotransport Na+, K+, 2Cl- from extracellular region to cytosol"")",Yes
Disease,,,,Deregulated CDK5 triggers multiple neurodegenerative pathways in Alzheimer's disease models,"=HYPERLINK(""https://reactome.org/content/detail/R-HSA-8870698"",""FASLG (FasL) gene expression"")",Yes
Disease,,,,Signaling by activated point mutants of FGFR3,"=HYPERLINK(""https://reactome.org/content/detail/R-HSA-2012073"",""Autocatalytic phosphorylation of FGFR3c P250R mutant"")",Yes
Disease,,,,Toxicity of tetanus toxin (TeNT),"=HYPERLINK(""https://reactome.org/content/detail/R-HSA-5228578"",""TeNT LC cleaves target cell VAMP2"")",Yes
Disease,,,,Defective ABCA3 causes SMDP3,"=HYPERLINK(""https://reactome.org/content/detail/R-HSA-5683672"",""Defective ABCA3 does not transport PC, PG from ER membrane to lamellar body"")",Yes
Disease,,,,Nef and signal transduction,"=HYPERLINK(""https://reactome.org/content/detail/R-HSA-200908"",""Nef Binds and activates the Src-family tyrosine kinase Fyn"")",Yes
Disease,,,,"Defective ABCC9 causes CMD10, ATFB12 and Cantu syndrome","=HYPERLINK(""https://reactome.org/content/detail/R-HSA-5678418"",""Defective ABCC9 (in KCNJ11:ABCC9) does not transport K+ from extracellular region to cytosol"")",Yes
Disease,,,,Defective OPLAH causes 5-oxoprolinase deficiency (OPLAHD),"=HYPERLINK(""https://reactome.org/content/detail/R-HSA-5603208"",""Defective OPLAH does not hydrolyse OPRO"")",Yes
Disease,,,,Maturation of replicase proteins,"=HYPERLINK(""https://reactome.org/content/detail/R-HSA-9684282"",""nsp9 forms a homodimer"")",Yes
Disease,,,,InlA-mediated entry of Listeria monocytogenes into host cells,"=HYPERLINK(""https://reactome.org/content/detail/R-HSA-8877003"",""CBLL1 ubiqutinates the InlA-bound CDH1 complex"")",Yes
Disease,,,,Constitutive Signaling by Ligand-Responsive EGFR Cancer Variants,"=HYPERLINK(""https://reactome.org/content/detail/R-HSA-1225957"",""SOS-mediated nucleotide exchange of RAS (mediated by GRB2:SOS1 in complex with phosphorylated SHC1 and ligand-responsive p-6Y-EGFR mutants)"")",Yes
Disease,,,,Maturation of nucleoprotein,"=HYPERLINK(""https://reactome.org/content/detail/R-HSA-9694373"",""Unphosphorylated nucleoprotein translocates to the plasma membrane"")",Yes
Disease,,,,Maturation of nucleoprotein,"=HYPERLINK(""https://reactome.org/content/detail/R-HSA-9683606"",""Nucleoprotein translocates to the nucleolus"")",Yes
Disease,,,,Defective SLC34A3 causes Hereditary hypophosphatemic rickets with hypercalciuria (HHRH),"=HYPERLINK(""https://reactome.org/content/detail/R-HSA-5651971"",""Defective SLC34A3 does not cotransport Pi, 2Na+"")",Yes
Disease,,,,Signaling by cytosolic FGFR1 fusion mutants,"=HYPERLINK(""https://reactome.org/content/detail/R-HSA-1839039"",""Tyrosine kinase inhibitors bind and inhibit cytosolic FGFR1 fusion dimer phosphorylation"")",Yes
Disease,,,,Signaling by cytosolic PDGFRA and PDGFRB fusion proteins,"=HYPERLINK(""https://reactome.org/content/detail/R-HSA-9673756"",""Autophosphorylation of cytosolic PDGFRA and PDGFRB fusion proteins"")",Yes
